{
  "deadLetterId": "00000000-0000-4000-8000-000000000061",
  "schemaVersion": "1.0.0",
  "missionId": "00000000-0000-4000-8000-000000000005",
  "datasetEpoch": "00000000-0000-4000-8000-000000000002",
  "sourceTopic": "stock-gap.agent.events.v1",
  "sourcePartition": 0,
  "sourceOffset": 42,
  "eventId": "00000000-0000-4000-8000-000000000064",
  "failedAt": "2026-01-15T12:00:00Z",
  "reason": "SCHEMA_INVALID",
  "deliveryCount": 1,
  "payloadSha256": "bbbbbbbbbbbbbbbbbbbbbbbbbbbbbbbbbbbbbbbbbbbbbbbbbbbbbbbbbbbbbbbb",
  "errorSummary": "Fixture : version de contrat refusée.",
  "quarantineId": "00000000-0000-4000-8000-000000000062"
}
